### ISSUE TITLE
Docker Macvlan not working using v.1.12.1

### ISSUE THREAD

**Issue by chadell** [lowescott/learning-tools#58]
I forked a repo (2016-dnf-materials) to create a testbed scenario to play with docker networking modes: https://github.com/chadell/2016-demo-net-linux-networking
I tried to reproduce the same macvlan scenario you had there (and here) using Docker v.1.12.1 instead of the plugin I get that the container can't ping a remote host through the eth1 which is connected to the internal bridge created by Vagrant for all the VM hosts.
Debugging it using tcpdump on the container, docker-01 (host) and remote-01 (a remote host), I realize that I get ARP request and replies either in the remote-01 and the container, but when comes to ICMP I see the remote-01 receiving ICMP request from the container and replying but not ICMP requests coming into eth1 in the docker-01 host (before sending to the container), and neither works the ICMP request from the remote-01.

```
Config used in docker-01 host:
sudo ip link set eth1 promisc on
sudo docker network create -d macvlan --subnet=192.168.100.0/24 -o parent=eth1 pub_net
sudo docker run -td alpine /bin/sh
sudo docker network connect pub_net 2bab90874f2f
```

Tcpdump in remote-01 (192.168.100.110), the container has 192.168.100.2:
```
09:30:45.279510 ARP, Request who-has 192.168.100.2 tell 192.168.100.110, length 28
09:30:45.279812 ARP, Reply 192.168.100.2 is-at 02:42:c0:a8:64:02 (oui Unknown), length 46
09:30:45.279819 IP 192.168.100.110 > 192.168.100.2: ICMP echo request, id 1849, seq 1, length 64
```

**Comment by lowescott** [comment]
@chadell Can you try enabling promiscuous mode for the VirtualBox virtual adapter? I see that you've set it from within the Linux VM, but I'd like for you to set it from outside the VM using VirtualBox. You can use the `vboxmanage` CLI tool (there's probably a GUI way too). Try that and then let me know if anything changes.

**Comment by chadell** [comment]
Hi @lowescott , I halted the VM and executed:
```
Name:            vboxnet2
GUID:            786f6276-656e-4274-8000-0a0027000002
DHCP:            Disabled
IPAddress:       192.168.100.1
NetworkMask:     255.255.255.0
IPV6Address:
IPV6NetworkMaskPrefixLength: 0
HardwareAddress: 0a:00:27:00:00:02
MediumType:      Ethernet
Status:          Up
VBoxNetworkName: HostInterfaceNetworking-vboxnet2

-> VBoxManage modifyvm 2016-demo-net-linux-networking_docker-01_1476002388560_11631 --nicpromisc2 allow-all
```
later, I reloaded the VM and restarted the docker container.

First, I checked it out if it worked and not, but I realized then that the eth1 in the linux VM wasn't in promiscuous mode (as it was before halting using Vagrant), so inside the VM I enabled the promiscuos mode, and doing it the ping worked!

I'm gonna try to add this promiscuos mode when starting the VM so I will have it ready for demos

Thank you very much for pointing out in the right direction 😄
